,Job Title,Job_Description,Link
68,Presales Senior Specialist at SAP Nigeria,"SAP Nigeria, is recruiting to fill the position of: Presales Senior Specialist. The position is located in Lagos State. Interested candidates should possess a Bachelor's degree in related fields (Business/Engineering or Technology), with at least 5 years work experience. - Click to read more..",www.hotnigerianjobs.com/hotjobs/178367/presales-senior-specialist-at-sap-
69,Project Associate at Vesta Healthcare Partners Nigeria Limited,"Vesta Healthcare Partners Nigeria Limited, is recruiting to fill the position of: Project Associate. The position is located in Victoria Island, Lagos State. Interested candidates should possess minimum of a First Degree qualification, with at least 2 years work experience. - Click to read more..",www.hotnigerianjobs.com/hotjobs/178366/project-associate-at-vesta-healthcare-partners-
70,Humanitarian Team Leader at Care International,"Care International, is recruiting to fill the position of: Humanitarian Team Leader. The position is located in Maiduguri, Borno State. Interested candidates should possess relevant qualifications, with 3 - 5 years work experience. - Click to read more..",www.hotnigerianjobs.com/hotjobs/178365/humanitarian-team-leader-at-care-
71,Head of Legal & Compliance at Nokia Nigeria,"Nokia Nigeria, is recruiting to fill the position of: Head of Legal & Compliance. Interested candidates should possess a Degree in Law, with at least 5 years work experience. - Click to read more..",www.hotnigerianjobs.com/hotjobs/178364/head-of-legal-compliance-at-nokia-
72,Christian Aid (CA) Fresh Job Recruitment (3 Positions),"Christian Aid (CA), is currently recruiting suitably qualified candidates to fill the following positions below:  - Click to read more..",www.hotnigerianjobs.com/hotjobs/178363/christian-aid-ca-fresh-job-recruitment-3-
73,Communications Officer at Christian Aid (CA),"Christian Aid (CA), is recruiting to fill the position of: Communications Officer. The position is located in Maiduguri, Borno State. Salary: N8,501,197. Interested candidates should possess a degree qualification, with at least 3 years work experience. - Click to read more..",www.hotnigerianjobs.com/hotjobs/178362/communications-officer-at-christian-aid-
74,Agricultural Extension Support Officer at Christian Aid (CA),"Christian Aid (CA), is recruiting to fill the position of: Agricultural Extension Support Officer. The position is located in Maiduguri, Borno State. Salary: N4,103,445. Interested candidates should possess a degree in Agricultural Science/Agronomy/Agric Extension/Animal Science, with at least 2 years work experience. - Click to read more..",www.hotnigerianjobs.com/hotjobs/178361/agricultural-extension-support-officer-at-
75,Field Support Officer at Christian Aid (CA),"Christian Aid (CA), is recruiting to fill the position of: Field Support Officer. The position is located in Maiduguri, Borno State. Salary: N4,103,445. Interested candidates should possess B.Sc in Agronomy, Agriculture, Agricultural Economics, Crop Science. - Click to read more..",www.hotnigerianjobs.com/hotjobs/178360/field-support-officer-at-christian-aid-
76,Procurement Coordinator at LekOil,"LekOil, is recruiting to fill the position of: Procurement Coordinator. The position is located in Lagos State. Interested candidates should possess a Bachelor's Degree in Engineering, Business Management or relevant discipline, with at least 5 years work experience. - Click to read more..",www.hotnigerianjobs.com/hotjobs/178359/procurement-coordinator-at-
77,Jireh Technologies Limited Fresh Graduate & Exp. Job Recruitment (4 Positions),"Jireh Technologies Limited, is recruiting to fill the following graduate and experienced positions below: - Click to read more..",www.hotnigerianjobs.com/hotjobs/178356/jireh-technologies-limited-fresh-graduate-exp-j
78,Accounting Clerk at PrimePort Logistics Limited,"PrimePort Logistics Limited, is recruiting to fill the position of: Accounting Clerk. The position is located in Rivers State. Interested candidates should possess a degree in Accounting, with at least 3 years work experience.  - Click to read more..",www.hotnigerianjobs.com/hotjobs/178358/accounting-clerk-at-primeport-logistics-
79,"Head, IT Audit at Stanbic IBTC Bank","Stanbic IBTC Bank, is recruiting to fill the position of: Head, IT Audit. The position is located in Lagos Island, Lagos State. Interested candidates should possess a degree qualification, with at least 10 years work experience. - Click to read more..",www.hotnigerianjobs.com/hotjobs/178357/head-it-audit-at-stanbic-ibtc-
80,Coca-Cola Naija Coke Summership Programme (Finance),"The Coca-Cola Company, invites applications from suitably qualified candidates for its 2018 Naija Coke Summership Programme (Finance). The Program provides a robust developmental platform for Nigerian students at home and abroad to intern with us to gain industry experience during their academic Summer breaks.  - Click to read more..",www.hotnigerianjobs.com/hotjobs/178330/cocacola-naija-coke-summership-programme-
81,Coca-Cola Naija Coke Summership Programme (Sales),"The Coca-Cola Company, invites applications from suitably qualified candidates for its 2018 Naija Coke Summership Programme (Sales). The Program provides a robust developmental platform for Nigerian students at home and abroad to intern with us to gain industry experience during their academic Summer breaks.  - Click to read more..",www.hotnigerianjobs.com/hotjobs/178331/cocacola-naija-coke-summership-programme-
82,Coca-Cola Naija Coke Summership Programme (Marketing),"The Coca-Cola Company, invites applications from suitably qualified candidates for its 2018 Naija Coke Summership Programme (Marketing). The Program provides a robust developmental platform for Nigerian students at home and abroad to intern with us to gain industry experience during their academic Summer breaks.  - Click to read more..",www.hotnigerianjobs.com/hotjobs/178332/cocacola-naija-coke-summership-programme-
83,Coca-Cola Naija Coke Summership Programme (Procurement),"The Coca-Cola Company, invites applications from suitably qualified candidates for its 2018 Naija Coke Summership Programme (Procurement). The Program provides a robust developmental platform for Nigerian students at home and abroad to intern with us to gain industry experience during their academic Summer breaks.  - Click to read more..",www.hotnigerianjobs.com/hotjobs/178333/cocacola-naija-coke-summership-programme-procu
84,Coca-Cola Naija Coke Summership Programme (Logistics),"The Coca-Cola Company, invites applications from suitably qualified candidates for its 2018 Naija Coke Summership Programme (Logistics). The Program provides a robust developmental platform for Nigerian students at home and abroad to intern with us to gain industry experience during their academic Summer breaks.  - Click to read more..",www.hotnigerianjobs.com/hotjobs/178334/cocacola-naija-coke-summership-programme-
85,Coca-Cola Naija Coke Summership Programme (Manufacturing),"The Coca-Cola Company, invites applications from suitably qualified candidates for its 2018 Naija Coke Summership Programme (Manufacturing). The Program provides a robust developmental platform for Nigerian students at home and abroad to intern with us to gain industry experience during their academic Summer breaks.  - Click to read more..",www.hotnigerianjobs.com/hotjobs/178335/cocacola-naija-coke-summership-programme-manufactu
86,Coca-Cola Naija Coke Summership Programme (Human Resources),"The Coca-Cola Company, invites applications from suitably qualified candidates for its 2018 Naija Coke Summership Programme (Human Resources). The Program provides a robust developmental platform for Nigerian students at home and abroad to intern with us to gain industry experience during their academic Summer breaks.  - Click to read more..",www.hotnigerianjobs.com/hotjobs/178336/cocacola-naija-coke-summership-programme-human-
87,IMC Administrator (Experienced) at Jireh Technologies Limited ,"Jireh Technologies Limited, is recruiting to fill the position of: IMC Administrator (Experienced). The position is located in Port Harcourt, Rivers State. Interested candidates should possess B.Sc / B.eng/ B. Tech /HND In Electrical & Electronic Engineering/ Computer Science/ Engineering or related discipline, with at least 3 years work experience. - Click to read more..",www.hotnigerianjobs.com/hotjobs/178355/imc-administrator-experienced-at-jireh-
88,ICT Sales Engineer (Experienced) at Jireh Technologies Limited ,"Jireh Technologies Limited, is recruiting to fill the position of: ICT Sales Engineer (Experienced). The position is located in Port Harcourt, Rivers State. Interested candidates should possess B.Sc / B.Eng/ B. Tech /HND in Electrical & Electronic Engineering or related discipline, with at least 3 years work experience. - Click to read more..",www.hotnigerianjobs.com/hotjobs/178354/ict-sales-engineer-experienced-at-jireh-
89,Graduate ICT Project Engineer (Trainee) at Jireh Technologies Limited ,"Jireh Technologies Limited, is recruiting to fill the position of: ICT Project Engineer (Trainee). The position is located in Port Harcourt, Rivers State. Interested candidates should possess B.Sc / B.Eng/ B. Tech /HND in Electrical & Electronic Engineering, Information Technologies, Computer Engineering, Computer Science or related discipline. - Click to read more..",www.hotnigerianjobs.com/hotjobs/178353/ict-project-engineer-trainee-at-jireh-
90,ICT Project Engineer (Experience) at Jireh Technologies Limited ,"Jireh Technologies Limited, is recruiting to fill the position of: ICT Project Engineer (Experience). The position is located in Port Harcourt, Rivers State. Interested candidates should possess B.Sc / B.Eng/ B.Tech /HND in Electrical & Electronic Engineering or related discipline, with 3-5 years work experience. - Click to read more..",www.hotnigerianjobs.com/hotjobs/178352/ict-project-engineer-experience-at-jireh-
91,Digital Media Advisor at Reboot,"Reboot, is recruiting to fill the position of: Digital Media Advisor. The position is located in Abuja. Interested candidates should possess a university degree in relevant field, with 3-5 years work experience. - Click to read more..",www.hotnigerianjobs.com/hotjobs/178351/digital-media-advisor-at-
92,Program Manager at Reboot ,"Reboot, is recruiting to fill the position of: Program Manager. The position is located in Abuja. Interested candidates should possess a Graduate degree in a relevant field, with at least 8 years work experience. - Click to read more..",www.hotnigerianjobs.com/hotjobs/178350/program-manager-at-
